query T
SELECT sha2('Snowflake', 224)
----
6267d3d7a59929e6864dd4b737d98e3ef8569d9f88a7466647838532

exclude-from-coverage
statement ok
CREATE OR REPLACE TABLE sha_table(
    v VARCHAR, 
    v_as_sha1 VARCHAR,
    v_as_sha1_hex VARCHAR,
    v_as_sha1_binary BINARY,
    v_as_sha2 VARCHAR,
    v_as_sha2_hex VARCHAR,
    v_as_sha2_binary BINARY
    );

exclude-from-coverage
statement ok
INSERT INTO sha_table(v) VALUES ('AbCd0');

statement ok
UPDATE sha_table SET 
    v_as_sha1 = SHA1(v),
    v_as_sha1_hex = SHA1_HEX(v),
    v_as_sha1_binary = SHA1_BINARY(v),
    v_as_sha2 = SHA2(v),
    v_as_sha2_hex = SHA2_HEX(v),
    v_as_sha2_binary = SHA2_BINARY(v)
    ;

query TTT
SELECT v, v_as_sha2, v_as_sha2_hex
  FROM sha_table
  ORDER BY v
----
AbCd0	e1d8ba27889d6782008f495473278c4f071995c5549a976e4d4f93863ce93643	e1d8ba27889d6782008f495473278c4f071995c5549a976e4d4f93863ce93643

