exclude-from-coverage
statement ok
CREATE OR REPLACE TABLE vartab (n NUMBER(2), v VARIANT);

exclude-from-coverage
statement ok
INSERT INTO vartab
  SELECT column1 AS n, PARSE_JSON(column2) AS v
    FROM VALUES (1, 'null'), 
                (2, null), 
                (3, 'true'),
                (4, '-17'), 
                (5, '123.12'), 
                (6, '1.912e2'),
                (7, '"Om ara pa ca na dhih"  '), 
                (8, '[-1, 12, 289, 2188, false,]'), 
                (9, '{ "x" : "abc", "y" : false, "z": 10} ') 
       AS vals;

statement error
INSERT INTO vartab
SELECT column1 AS n, PARSE_JSON(column2) AS v
  FROM VALUES (10, '{ "a" : "123", "b" : "456", "a": "789"} ')
     AS vals;
----
100069 (22P02): DML operation to table VARTAB failed on column V with error: Error parsing JSON: duplicate object attribute "a", pos 31

statement ok
INSERT INTO vartab
SELECT column1 AS n, PARSE_JSON(column2, 'd') AS v
  FROM VALUES (10, '{ "a" : "123", "b" : "456", "a": "789"} ')
     AS vals;

query T
SELECT v
  FROM vartab
  WHERE n = 10
----
'{"a":"789","b":"456"}'

query TTTT
SELECT TO_JSON(NULL), TO_JSON('null'::VARIANT),
       PARSE_JSON(NULL), PARSE_JSON('null')
----
NULL	"null"	NULL	null

exclude-from-coverage
statement ok
CREATE OR REPLACE TABLE jdemo2 (
  varchar1 VARCHAR, 
  variant1 VARIANT);

exclude-from-coverage
statement ok
INSERT INTO jdemo2 (varchar1) VALUES ('{"PI":3.14}');

statement ok
UPDATE jdemo2 SET variant1 = PARSE_JSON(varchar1);

query TTTTTT
SELECT varchar1, 
       PARSE_JSON(varchar1), 
       variant1, 
       TO_JSON(variant1),
       PARSE_JSON(varchar1) = variant1, 
       TO_JSON(variant1) = varchar1
  FROM jdemo2
----
'{"PI":3.14}'	'{"PI":3.14}'	'{"PI":3.14}'	'{"PI":3.14}'	TRUE	TRUE

query TTT
SELECT TO_JSON(PARSE_JSON('{"b":1,"a":2}')),
       TO_JSON(PARSE_JSON('{"b":1,"a":2}')) = '{"b":1,"a":2}',
       TO_JSON(PARSE_JSON('{"b":1,"a":2}')) = '{"a":2,"b":1}'
----
'{"a":2,"b":1}'	FALSE	TRUE

exclude-from-coverage
statement ok
CREATE OR REPLACE TABLE jdemo3 (
  variant1 VARIANT,
  variant2 VARIANT);

exclude-from-coverage
statement ok
INSERT INTO jdemo3 (variant1, variant2)
  SELECT
    PARSE_JSON('{"PI":3.14}'),
    TO_VARIANT('{"PI":3.14}');

query TTTTT
SELECT variant1,
       TYPEOF(variant1),
       variant2,
       TYPEOF(variant2),
       variant1 = variant2
  FROM jdemo3
----
'{"PI":3.14}'	OBJECT	"{\"PI\":3.14}"	VARCHAR	FALSE

